<?xml version="1.0" encoding="UTF-8" standalone="no"?>
<!DOCTYPE Diff PUBLIC "hello" "DiffScriptDefinition.dtd">
<Diff>
    <meta>
        <SourceString>212e04aaedde8510415d5cfe8c1ba514</SourceString>
        <DestinationString>10d5e3f4f321294416bd6b418773dd67</DestinationString>
    </meta>
    <EditScript>
        <Update>
            <newNucl>R</newNucl>
            <oldNucl>G</oldNucl>
            <updateIndex>0</updateIndex>
            <reverseIndex>0</reverseIndex>
        </Update>
        <Delete>
            <nucl>U</nucl>
            <deleteIndex>1</deleteIndex>
            <reverseIndex>1</reverseIndex>
        </Delete>
        <Update>
            <newNucl>N</newNucl>
            <oldNucl>A</oldNucl>
            <updateIndex>2</updateIndex>
            <reverseIndex>1</reverseIndex>
        </Update>
        <Update>
            <newNucl>R</newNucl>
            <oldNucl>G</oldNucl>
            <updateIndex>3</updateIndex>
            <reverseIndex>2</reverseIndex>
        </Update>
        <Update>
            <newNucl>N</newNucl>
            <oldNucl>U</oldNucl>
            <updateIndex>4</updateIndex>
            <reverseIndex>3</reverseIndex>
        </Update>
        <Update>
            <newNucl>R</newNucl>
            <oldNucl>A</oldNucl>
            <updateIndex>5</updateIndex>
            <reverseIndex>4</reverseIndex>
        </Update>
        <Delete>
            <nucl>C</nucl>
            <deleteIndex>6</deleteIndex>
            <reverseIndex>5</reverseIndex>
        </Delete>
    </EditScript>
</Diff>
