<?xml version= "1.0"?>
<!DOCTYPE Diff PUBLIC "hello" "DiffScriptDefinition.dtd">

<Diff>
    <meta>
        <!--SourceString and DestinationString hashCodes to identify the sequences that this file refers to-->
        <SourceString>123123123</SourceString>
        <DestinationString>123321123</DestinationString>
    </meta>
    <EditScript>
        <Insert>
            <!-- getIndex:index of char in destination string , dropIndex: index to insert character at ( after this index ) -->
            <nucl>R</nucl>
            <insertIndex>4</insertIndex>
        </Insert>
        <Delete>
            <!--index to delete from the source string-->
            <nucl>N</nucl>
            <deleteIndex>4</deleteIndex>
        </Delete>
        <Update>
            <!-- getIndex: index of char in destination string , updateIndex: index of source sequence which we should update to match char -->
            <newNucl>A</newNucl>
            <oldNucl>C</oldNucl>
            <updateIndex>9</updateIndex>
        </Update>
    </EditScript>
</Diff>